{
  "from": "1.3.0",
  "to": "1.4.0",
  "features": {
    "new": [],
    "changed": [
      { "id": "filtering", "use_cases": ["save-filters"], "summary": "Filters can be saved under a name and applied again." },
      { "id": "starting-a-game", "use_cases": ["two-player-game"], "summary": "Remembers the last number of players and starting life." }
    ],
    "removed": []
  },
  "assets": {
    "new": [],
    "changed": [{ "id": "filtering/stack-filters/filter-sheet", "difference": 0.21 }],
    "removed": []
  }
}
